{
  "candidate": {},
  "checkout": {},
  "ended_at": "2026-08-08T00:01:00Z",
  "envelope_digest": "sha256:0000000000000000000000000000000000000000000000000000000000000000",
  "execution_policy": {
    "python_bytecode_control": "env-and-flag",
    "repository_temp_policy": "outside-checkout",
    "repository_write_policy": "forbidden",
    "transient_write_monitor": "enabled"
  },
  "launch_id": "launch-1",
  "parent_context": false,
  "prompt_digest": "sha256:0000000000000000000000000000000000000000000000000000000000000000",
  "raw_evidence_digest": "sha256:0000000000000000000000000000000000000000000000000000000000000000",
  "raw_evidence_locator": "artifact:1",
  "requested": {},
  "runtime": {},
  "schema_version": 2,
  "session_id": "s1",
  "spec_digest": "sha256:0000000000000000000000000000000000000000000000000000000000000000",
  "started_at": "2026-08-08T00:00:00Z",
  "termination_state": "completed",
  "workspace_id": "workspace-1"
}
